{
    "v": "5.5.8",
    "fr": 30,
    "ip": 0,
    "op": 60,
    "w": 500,
    "h": 500,
    "nm": "Bouncing Ball",
    "ddd": 0,
    "assets": [],
    "layers": [
      {
        "ddd": 0,
        "ind": 1,
        "ty": 4,
        "nm": "Ball",
        "sr": 1,
        "ks": {
          "o": { "a": 0, "k": 100 },
          "r": { "a": 0, "k": 0 },
          "p": { "a": 1, "k": [{ "t": 0, "s": [250, 100, 0], "e": [250, 400, 0], "i": { "x": 0.5, "y": 1 }, "o": { "x": 0.5, "y": 0 } }, { "t": 60, "s": [250, 400, 0], "e": [250, 100, 0], "i": { "x": 0.5, "y": 1 }, "o": { "x": 0.5, "y": 0 } }] },
          "a": { "a": 0, "k": [0, 0, 0] },
          "s": { "a": 0, "k": [100, 100, 100] }
        },
        "shapes": [
          {
            "ty": "el",
            "p": { "a": 0, "k": [0, 0] },
            "s": { "a": 0, "k": [100, 100] },
            "nm": "Ellipse Path 1"
          },
          {
            "ty": "st",
            "c": { "a": 0, "k": [0.9, 0.1, 0.1, 1] },
            "o": { "a": 0, "k": 100 },
            "w": { "a": 0, "k": 0 },
            "nm": "Stroke 1"
          },
          {
            "ty": "fl",
            "c": { "a": 0, "k": [0.9, 0.1, 0.1, 1] },
            "o": { "a": 0, "k": 100 },
            "nm": "Fill 1"
          }
        ],
        "ip": 0,
        "op": 60,
        "st": 0,
        "bm": 0
      }
    ]
  }
  